AppointmentID,PatientID,StaffID,AppointmentDate,AppointmentTime,RoomName,Purpose,Note,Status
0301202TH002,M1999TH06051,NULL,2020-01-03,NULL,NULL,"Shortness of breath, Sore throat",NULL,NULL
0501204MK003,M2009MK30116,M197019DT117,2020-01-05,07:31:59,A010001,"Severe shortness of breath, Persistent chest pain, Loss of consciousness","On the way to the emergency room",Complete
1001203NT004,M2001NT07832,M197119TB114,2020-01-10,08:30:00,A040013,"Shortness of breath, dry cough",NULL,Complete
1201203TL006,M2006TL30087,M197419AK725,2020-01-12,NULL,B020045,"heart attack",NULL,Complete
1201205CV005,M2004CV30129,NULL,2020-01-12,NULL,B020045,"Heart attack",NULL,Complete
3112192MH001,F2004MH86032,F197820KL120,2019-12-31,NULL,A040012,"Dry cough, Shortness of breath, Sore throat",NULL,Canceled
